First Level Heading,Second Level Heading,Third Level Heading,Definition
Multilingual Demographic Dictionary,Chapter 3 • Distribution and classification of the population,346,"Current school statistics1 may distinguish between the number of pupils enrolled2 and the number of pupils in attendance3. A comparison of these two figures gives an attendance ratio4. Compulsory education5 implies the existence of a range of ages where school attendance is obligatory by law. This makes it possible to specify the number of children of school age6 or the school-age population7 according to a legal criterion.
Note:The attendance ratio is the ratio of pupils in attendance to pupils enrolled, whereas the enrollment ratio is that of pupils enrolled to the school-age population."
Multilingual Demographic Dictionary,Chapter 3 • Distribution and classification of the population,347,"Other statistics concern educational progression. An individual progresses normally grade by grade, from the lowest class of elementary school, to the end of his studies. Leaving school1, where compulsory education is enforced, is exceptional during school age, barring illness or death. The dropout rate2 is the probability of leaving school before obtaining a degree, either during the year or at the end of a grade, and it is constructed in the same way as a probability of dying in a life table; its complement to one is the retention rate3. Such rates can be used to compute a table of school life4, from which it is possible to infer the mean length of schooling5. At the end of the school year, pupils or students who do not terminate their studies, may either repeat the grade or move on to the next grade, with or without change of track6. According to the fate of these pupils or students at the end of the academic year, proportion repeating a school year7★ are established."
Multilingual Demographic Dictionary,Chapter 3 • Distribution and classification of the population,350,"A distinction is generally made between the working population1 or economically active population1 and the unoccupied population2 or economically inactive population2. Generally speaking, the working population consists of those individuals engaged in gainful activities3. A gainful activity, or economic activity3, is an activity which contributes to the production of income. Unpaid family workers (353-5) are usually included in the economically active population. Homemakers4 or housewives4 engaged in unpaid domestic duties, students, retired workers, etc. are usually excluded. The members of the economically inactive population are sometimes referred to as dependents5 (358-1) in the sense that they subsist on the product of the working population. (See, however, the different sense of this term stated in § 358). The ratio of the working population to the total population, usually computed with reference to a given sex-age group or other category, is called the activity ratio6 or labor force participation ratio6.
Note:The terms gainfully occupied population, gainful workers, labor force are used as synonyms for working population and economically active population.For statistical measurement of the working population, the gainful worker concept or the labor force concept may be used. According to the gainful worker concept, the working population is defined as being composed of those persons who have a gainful activity which they normally exercise. According to the labor force concept, it is defined as the group of persons who were working at a gainful occupation or wanting or seeking such work during a specified period preceding the inquiry."
Multilingual Demographic Dictionary,Chapter 3 • Distribution and classification of the population,351,"Workers1 who make up the working population can be classified as employed2 or unemployed3. Under the labor force concept (350-1 *), only persons who were actively seeking work4 or are on temporary layoff during the specified period are usually counted as unemployed. It is important to distinguish between persons who have never had a job and persons who are looking for their first job11★ or first-time job seekers11★. The employed population5 consists of all those currently working for pay or profit. Among the economically active, a substantial portion of workers may be compelled by the economic conditions of the country or of the time, to perform less work than they would normally be able and willing to perform; in this instance, the terms underemployment6 or partial employment6 are used. Marginal workers7 who only very occasionally participate in economic activity, are most often classified as not in the labor force under the gainful worker concept (350-1 *). The employment to population ratio8★ is the proportion of employed persons in the working age group (usually 15 to 64). Inactive persons9★ are those who do not accomplish any kind of professional activity neither are looking for any employment.  Hidden unemployment10★ or labor reserve10★  includes people who, although not officially registered as unemployed, are looking for a private work as well as those who do not exercise nor are looking for a job but if some job opportunities arose to them, could respond.
Note:Employed, n. and adj. - employment, n.: situation of an individual exercising an economic activity. Employment status refers to the classification as either employed or unemployed. Unemployed, n. and adj. - unemployment, n. One refers occasionally to underutilization of the labor force. Under-employment and underutilization also sometimes refer to the situation of persons who perform below their level of qualification."
Multilingual Demographic Dictionary,Chapter 3 • Distribution and classification of the population,352,"The occupational classification1 of the working population (350-1) shows its members grouped by occupation2. The similarity of the work done by workers, including the similarity of skills and training required are the main criteria used for grouping occupations into occupational groups3 or occupational classes3.
Note:For purposes of comparability, the International Labour Office has prepared an International Standard Classification of Occupations."
Multilingual Demographic Dictionary,Chapter 3 • Distribution and classification of the population,353,"The working population (350-1) is also usually classified by work status1. In this classification employers2 are distinguished from employees3 on the one hand and from workers on own account4 or independent workers4 on the other. The latter do not employ labor for pay, but they, as well as employers, may be assisted by unpaid family workers5 or family helpers5 who are usually distinguished as a separate group. A combination of occupational and status classifications may be used to construct social status categories6.
Note:The classification by status (as employer, employee, etc.) is designated by many different terms in the censuses of various countries, including “industrial status”, “states in employment”, “position in industry”, “class of worker”, etc. Managers are sometimes counted with employers though they are themselves employed."
Multilingual Demographic Dictionary,Chapter 3 • Distribution and classification of the population,354,"Various sub-groups of the category of employees (353-3) are sometimes distinguished. One such sub-group is home workers1 or cottage workers1, who work in their own homes, sometimes for several employers. Among the employees a distinction is sometimes made between manual workers2 and non-manual workers3 or clerical and office workers3. Manual workers may be further sub-divided according to their skill4, with skilled workers5, semi-skilled workers6, and unskilled workers7 being distinguished. Apprentices8 are sometimes shown as a sub-category of employees.
Note:Another type of classification of employees is that which distinguishes between wage earners who are paid daily or weekly and salaried employees who are paid monthly or at even less frequent intervals. The statistics of the United States distinguish four broad occupational categories: white collar workers; blue collar workers, including craftsmen, operatives and non-farm laborers; service workers; and farm workers (cf. 356). A laborer is an unskilled worker, who does physical work."
Multilingual Demographic Dictionary,Chapter 3 • Distribution and classification of the population,355,"Among the employees (353-3) a distinction is often made between the managerial staff1, who make policy decisions; the executive staff2 who apply the decisions; and supervisors3 or foremen3 who direct the operative. Officials () are divided into simple or lower service4★, mainly for positions of menial work(eg, administrative assistants, technical assistants), middle service5★, mainly for positions requiring roughly the equivalent of a completed apprenticeship (eg, editors, administrative secretaries), upper service6★, mainly for positions requiring a Bachelor’s degree or its equivalent (administrative frameworks or technical) and senior service7★, restricted to graduates holding a Master’s degree or its equivalent.
Note:The term executive in the United States of America refers to a member of the managerial staff."
Multilingual Demographic Dictionary,Chapter 3 • Distribution and classification of the population,356,"Special classifications apply in agriculture. Farmers1 or farm operators1 are those who farm the land for profit; among them we distinguish between farm-owners2, who own their land, tenant farmers3, who rent it from a landlord, and share-croppers3, who give a portion of the crop in return for the use of land and livestock. Agricultural laborers4 are persons working who are employed by farmers.
Note:A farm manager who is salaried is generally classed as a farmer. In Scotland a small farmer is sometimes called a crofter. A farmer with a very small farm is also known as a smallholder. Agricultural laborers are of three general types: fulltime agricultural laborers, day agricultural laborers, and seasonal agricultural laborers. This last category often consists of migrant laborers."
Multilingual Demographic Dictionary,Chapter 3 • Distribution and classification of the population,357,"The working population may also be classified by industry1 or branch of economic activity1. This classification depends on the nature of the firm2 or establishment2 that the individual works for. Generally importance is attached to the division of the population into agricultural workers3 and non-agricultural workers4. Government employees5 are sometimes, and military personnel6 or members of the armed forces6 are generally shown separately, but employees of public enterprises are counted as a rule with the rest of the industrial population. Industries are generally classified in three sectors, the primary sector7 (agriculture, hunting, fishing and mining), the secondary sector8 (manufacturing, construction and utilities), and the tertiary sector9 (commerce, finance, transport industries, and service industries). In developing countries the traditional sector10 is often listed separately and opposed to the modern sector of the economy.
Note:For purposes of international comparability, the United Nations have prepared an International Standard Industrial Classification of All Economic Activities. A civil servant is an employee (353-3) of the central government. An official is an employee of a public body but the term is occasionally used for salaried employees of large companies. A distinction is often drawn between government employees and private workers."
Multilingual Demographic Dictionary,Chapter 3 • Distribution and classification of the population,358,"The economically inactive population may be divided into dependents1 (350-5) and self-supporting persons2. Dependents depend for their support on the efforts of earners3 or breadwinners3; this is for example the case of housewives (350-4) and dependent children4. Self-supporting persons have sufficient means for their subsistence. They may be rentiers5 or persons of independent means5, retired persons6 or pensioners6. A special category of dependents is that of persons receiving public assistance7 or public welfare recipients7. Persons incapable of work are called unemployable8. The ratio of the inactive to the active population is called the economic dependency ratio9.
Note:Dependent or dependant, n. - dependent, adj. - dependency or dependancy, n.: the state of being dependent. The ratio of the young and the elderly to the adult population is called the age dependency ratio."
Multilingual Demographic Dictionary,Chapter 3 • Distribution and classification of the population,359,"It is possible to classify the population by the sector of economic activity from which they derive their livelihood, dependants being put into the same category as their breadwinners. We speak of the population dependent on1 a particular branch of activity and in particular of the population dependent on agriculture2. The term agricultural population2 is sometimes used as a synonym, but may also be employed in the sense of farm population2 which lives on farms or is dependent on agriculture and which is distinguished from the non-farm population3 or non-agricultural population3."
Multilingual Demographic Dictionary,Chapter 3 • Distribution and classification of the population,360,"The infirm1 or handicapped1 are often separately shown in censuses. They are classified according to the nature of their infirmity2 or handicap2. Physical infirmities3 or physical handicaps3 such as blindness, or deaf-mutism are generally distinguished from mental infirmities4 or mental handicaps4, such as feeblemindedness or dementia."
Multilingual Demographic Dictionary,Chapter 3 • Distribution and classification of the population,361,"The study of the working life1 of individuals includes the study of the accession to the labor force2 and of the separation from the labor force3. At accession it is possible to distinguish those who have never been active, from those who belonged to the labor force at an earlier date; separations may be listed by cause, e.g. death, retirement4, temporary withdrawal. The analysis may proceed by cohort or period, and it involves rates of accession to the labor force5, or probabilities of accession to the labor force6, rates of separation from the labor force7 or probabilities of separation from the labor force8, eventually by cause; these indices are computed by age or age-group."
Multilingual Demographic Dictionary,Chapter 3 • Distribution and classification of the population,362,"These indices serve to compute tables of working life1, by period or cohort. In addition to the probabilities described in the previous paragraph, these tables contain the distributions by age at accession to the labor force2 and by age at separation from the labor force3, (eventually by cause, before and after accounting for mortality), the mean age at accession to the labor force4 and the mean age at separation from the labor force5. The expectation of working life6, the gross expectation of working life7 (which excludes the effect of mortality) and the net expectation of working life8 (which includes it) all represent the mean number of years of working life that remain to be lived at each age by the active population. For those entering the labor force at that age, this expectation constitutes the mean duration of working life9; a similar index can be computed for all ages at accession taken together.
Note:Such tables are computed when temporary withdrawals from the labor force are a negligible proportion of the total, and this condition is approximately realized for males. For females, it is necessary to distinguish first accession to the labor force, or entry into the labor force, from re-entry into the labor force."
Multilingual Demographic Dictionary,Chapter 4 • Mortality and morbidity,401,"The study of mortality1 deals with the effect of death on the population. The general terms mortality rate2 or death rate2 encompass all the rates (133-4) which measure the frequency of deaths3. Where the expression death rate is used without any qualifying adjective the crude death rate4 is usually meant (cf. 136-8 for a general discussion of crude rates). This is generally an annual rate and consists of the ratio of the annual number of deaths occurring during a calendar year to the number exposed to the risk of dying during the same period. This number is equivalent to the mean population5 or average population5 for the period, and the population at the mid-point of the period can usually be substituted for the average population without appreciable error, if the size of the population is changing fairly uniformly. If the mortality of a sub-population (101-6) only is studied, we speak of specific death rates (134-6) among which sex-age-specific death rates6 are the most common. Age specific death rates7 without distinction of sex are also used on occasion.
Note:Occasionally the term mortality is used as a synonym for mortality rate or death rate. Death, n. - die, v. - dead, adj. syn. - deceased, adj. or n. When the observation period exceeds one year, the mean population is generally obtained as the average of several estimates of the size of the population for each year. The average number of persons years (135-6) is also used as denominator."
Multilingual Demographic Dictionary,Chapter 4 • Mortality and morbidity,402,"Specific death rates may be used to study differential mortality1 or mortality differences1 between groups, and reference is made to an excess mortality2 of one group as compared with another, or with the rest of the population. It is measured by an excess mortality index3★. The study of differences in the death rates of specific occupations is called the study of occupational mortality4. In a rather different sense the term occupational mortality5 may refer to the mortality from hazards associated with a particular occupation. Among these, we may mention occupational diseases6.
Note:Differentials in mortality is also encountered. The expression excess male mortality implies a comparison with the corresponding female mortality, e.g. at the same age."
Multilingual Demographic Dictionary,Chapter 4 • Mortality and morbidity,403,"Crude death rates (401-4) will depend upon the structure [particularly the age structure (325-6)] of the population as well as on the level of mortality. If the mortality of different populations is to be compared standardized mortality rates1 or adjusted mortality rates1 are sometimes computed to eliminate the effect of differences in population structure (144-4). Age is the characteristic for which mortality rates are adjusted most frequently by reference to a standard population2 with a given structure. If specific rates (134-6) for the population studied are available, it is possible to use the direct method of standardization3 which consists of applying these rates to the corresponding groups of the standard population. If specific rates are not available, it is still possible to obtain standardized mortality rates by the indirect method of standardization4. More frequently, comparative mortality indices5 are computed by applying standard mortality rates6 to the different groups of the population studied and summing these to obtain an expected number of deaths; the indices are then obtained by comparing the observed deaths7 in the population with the expected deaths8 which would have occurred had the standard rates applied.
Note:Standardize, v. - standardized, adj. - standardization, n.: the process of standardizing. If a crude death rate (401-4) is multiplied by a comparative mortality index, we obtain an indirectly standardized death rate. In British official terminology, when occupational mortality is studied, the figure obtained by direct standardization is called a comparative mortality figure and that obtained by indirect standardization a standardized mortality ratio."
Multilingual Demographic Dictionary,Chapter 4 • Mortality and morbidity,410,"The mortality of live-born children who have not yet reached their first birthday is called infant mortality1. The mortality of live-born children who die before reaching a certain age taken as four weeks or 28 days, the so-called neo-natal period3, is called neo-natal mortality2. The mortality during the first week of life and between the first week until before 28 days are called respectively early neo-natal mortality4 and late neo-natal mortality6★. The term post-neonatal mortality5 refers to deaths after the neo-natal period, but before reaching the age of one year.
Note:In certain statistics the neo-natal period is defined as the first month of life. The term early infancy is occasionally used as an approximate equivalent to the neo-natal period, as, e.g., in ""diseases of early infancy."""
Multilingual Demographic Dictionary,Chapter 4 • Mortality and morbidity,411,"The expression foetal mortality1 is used for deaths prior to the complete expulsion or extraction from its mother of a product of conception (602-6) irrespective of the duration of pregnancy (603-3). The terms intra-uterine mortality1 or mortality in utero1 may also be used. The corresponding deaths are called foetal deaths2 or intra-uterine deaths2. Early foetal mortality3 occurs before the twentieth week of gestational life, while intermediate foetal mortality4 occurs between the twentieth and the 28th week of gestation. After the twenty-eighth week, one refers to late foetal mortality5 and the product is called a late foetal death5 or, popularly, a stillbirth5. Perinatal mortality6 includes late foetal mortality and a portion of infant mortality that may include either early neo-natal deaths, or all neo-natal deaths. The foeto-infant mortality7★ includes stillbirths and deaths of children under one year.
Note:Foetal - also spelled fetal. Also designated as pregnancy wastage. These terms include abortions (603-5), miscarriages (604-1) and stillbirths. Early foetal deaths are also popularly known as miscarriages. Stillbirth, n. - stillborn, adj. In certain countries, including France, children born alive who died before registration may be legally included among the stillborn, and are called false stillbirths. The corresponding deaths are called perinatal deaths."
Multilingual Demographic Dictionary,Chapter 4 • Mortality and morbidity,412,"The ratios of deaths under one year of age1, of deaths of less than 28 days, and of deaths of less than one week, occurring in a year, to the number of live births of the same year give respectively the infant mortality rate2, the neo-natal mortality rate3 and the early neo-natal mortality rate4. These rates are generally expressed per one thousand live births. When deaths are cross-classified by age and year of birth, it is possible to divide the deaths under one year by the births in the two cohorts to which they belong. The resulting index is an adjusted infant mortality rate5 equivalent to a probability of dying before age one5. In the absence of such information separation factors6 may be estimated, which divide infant deaths into those occurring to infants born in the current calendar year and to infants born in the previous calendar year."
Multilingual Demographic Dictionary,Chapter 4 • Mortality and morbidity,413,"The proportion of late foetal deaths (411-5) among all births is called a late foetal mortality rate1. The ratio of late foetal deaths to live births (601-4) is called a late foetal mortality ratio2. A foetal mortality rate3 represents the number of known intra-uterine deaths per one thousand births in the same year while the foetal mortality ratio4 is the ratio of intra-uterine deaths to live births in a given year. These indices greatly understate intra-uterine mortality since early intra-uterine deaths frequently remain unobserved or unknown. A better measurement of intra-uterine mortality is provided by intra-uterine mortality tables5, a specialized application of the life table (cf. 432) which takes into account the duration of gestation. The perinatal mortality rate6 relates perinatal deaths (411-6*) to the sum of late foetal deaths and live births. The foeto-infant death rate7★ represents the number of known stillbirths and deaths in the first year of life per one thousand live births and stillbirths of the same reporting period.
Note:Also called stillbirth rate. This usage is not recommended. Also called stillbirth ratio. This usage is not recommended. The perinatal mortality ratio relates perinatal deaths to live births only."
Multilingual Demographic Dictionary,Chapter 4 • Mortality and morbidity,414,"In the study of age-specific mortality1, the terms infant mortality (410-2) and neo-natal mortality (410-3) refer to generally accepted time periods. The usage of such terms as child mortality2, youth mortality3★, adult mortality4 or mortality of old age5 is not uniform. Post-infantile child death rate6 sometimes refers to the death rate between one and 4 years of age."
