First Level Heading,Second Level Heading,Third Level Heading,Definition
Multilingual Demographic Dictionary,Table of contents,,
Multilingual Demographic Dictionary,Introduction,History,
Multilingual Demographic Dictionary,Introduction,Why on-line?,
Multilingual Demographic Dictionary,Introduction,Functionality,
Multilingual Demographic Dictionary,Introduction,What is next?,
Multilingual Demographic Dictionary,Introduction,For an unified second edition of the dictionaries as an intermediate step,
Multilingual Demographic Dictionary,Preface,Preface of the first edition (1958),
Multilingual Demographic Dictionary,Preface,Preface of the second edition (1982),
Multilingual Demographic Dictionary,Preface,Preface of the unified second edition,
Multilingual Demographic Dictionary,Notice,Notes on the use of the dictionary,
Multilingual Demographic Dictionary,Notice,Exploring the dictionary on demopaedia.org,
Multilingual Demographic Dictionary,Notice,Citation,
Multilingual Demographic Dictionary,Notice,List of abbreviations,
Multilingual Demographic Dictionary,Chapter 1 • General concepts,101,"Demography1  is the scientific study of human populations primarily with respect to their size, their structure2 and their development; it takes into account the quantitative aspects of their general characteristics. It is the core of the population sciences8★, which in the broadest sense include interdisciplinary fields such as economic demography (104-1), social demography (104-2), population genetics (104-4), historical demography (102-1), mathematical demography (102-6) as well as contributions from the law, medicine, epidemiology (423-6), sociology, psychology, geography and philosophy. In statistical terminology any collection of distinct elements may be called a population3, a word that is synonymous with universe3. However, in demographic usage, the term population4 refers to all of the inhabitants5 of a given area, though on occasion it may be used for part of the inhabitants only [e.g., the school-age population (cf. 346-7), the marriageable population (cf. 514-2)]. Such groups are properly called sub-populations6. The term population is often used to denote more specifically the size7, i.e., the total number7 of the aggregate referred to in no. 101-4.
Note:Demography, n. - demographic, adj. - demographer, n.: a specialist in demography. Population, n. - Note that this term may also be used adjectivally as a synonym for demographic, e.g., in population problems, population analysis, population studies. Inhabitant, n. - inhabit, v.: to occupy as a place of settled residence."
Multilingual Demographic Dictionary,Chapter 1 • General concepts,102,"Certain sub-disciplines within demography have received special names reflecting their objectives or their methodology. Historical demography1 deals with populations of the past for which written records are available. In the absence of such sources, the study of ancient populations takes the name of paleo-demography2 . In descriptive demography3 the numbers, geographical distribution, structure and change of human populations are described by means of population statistics4 or demographic statistics4 . The treatment of quantitative relations among demographic phenomena in abstraction from their association with other phenomena, is called theoretical demography5 or pure demography5 ; because of its resort to various mathematical methods, in practice it is identified with mathematical demography6. A piece of research that applies the tools of demographic analysis (103-1) to an actual population is often called a demographic study7. This study can focus on the current demographic situation8★ or current demographic conditions8★, i.e. the population change and its indicators during a short and recent period. All the preceding disciplines place a great emphasis on the numerical aspects of the phenomena, and are sometimes referred to as formal demography9, when they apply only to the size and structure of the population. In contrast the broader term population studies10 also includes the treatment of relations between demographic events and social, economic or other phenomena."
Multilingual Demographic Dictionary,Chapter 1 • General concepts,103,"Demographic analysis1 is that branch of formal demography which controls for the effect of population size and structure on demographic processes2 and isolates the effects of demographic processes of interest from the others, the latter of which are called competing processes3★. It also studies the relations between demographic variables and how they interact to form population structures. A distinction is made between cohort analysis4 or generational analysis4 which focuses on a well defined cohort (cf. 117-2) followed through time, and cross-sectional analysis5 or period analysis5 which focuses on the demographic phenomena that occur during a precise time interval (such as a calendar year) among several cohorts.
Note:Panel analysis follows the same individuals case by case."
Multilingual Demographic Dictionary,Chapter 1 • General concepts,104,"The study of relations between demographic phenomena on one hand and economic and social phenomena on the other forms another branch of the subject. The terms economic demography1 and social demography2 have been used by some writers. Demography also deals with the study of population quality3. This phrase may be used with reference to all sorts of social and personal characteristics. In a slightly different sense the term primarily refers to the distribution and transmission of hereditary characteristics (910-3) which are the subject of population genetics4 . Human ecology5 is the study of the distribution and organization of communities with attention to the operation of competitive and cooperative processes and has part of its subject matter in common with demography. Fields of research and methodology are even more intertwined in the case of demography and human geography7★. It is also the case for biometry6 or biometrics6 and epidemiology8★ which deal with the application of statistical methods to all forms of biological and medical research.
Note:Population genetics is distinct from human genetics, which deals with the transmission of inheritable characteristics in man: population genetics includes the study of the distribution and transmission of hereditary traits in plant, animal and human populations. Ecology, n. - ecological, adj. - ecologist, n.: a specialist in ecology. Biometry, n. - biometrics, n. - biometric, adj. - biometrician, n.: a specialist in biometry. The terms biostatistics, n. - biostatistical, adj. - and biostatistician, n. are frequently encountered and are synonymous with the terms given for biometry."
Multilingual Demographic Dictionary,Chapter 1 • General concepts,105,"Finally, there is the study of population theories1. This term should not be confused with theoretical demography (102-5). Population theories are designed to explain or predict the interaction between changes in population and economic, social, psychological or other factors; they include purely conceptual treatments. Population theories occasionally form the basis of population policy2 (cf. §930), which deals with measures designed to influence population changes."
Multilingual Demographic Dictionary,Chapter 1 • General concepts,110,"A fundamental statistical unit1 used in demography is the individual2 or person2 . The term head2 has also been employed but this usage is now largely out of date. The household3, a socio-economic unit, consists of individuals who live together. Statistical definitions of the household vary. According to the definition which has been recommended as an international standard a household consists of a group of individuals who share living quarters (120-1) and their principal meals. The term hearth3 has been used in the past, showing that in the past members of the household used to share the same fire. Classifications of households also vary between different countries and different enquiries. Most classifications involve the distinction of two types: private households4 and collective households5 . An individual living by himself is considered to be a one-person household6 . A boarder7 is a person other than a domestic servant, who is unrelated to other members of the household and who habitually takes his meals with the household. A lodger8 or roomer8, on the other hand, does not habitually take his meals with the household. These two categories may or may not be included in the household for statistical purposes.
Note:Private households are called family households when their members are related. Collective  households may include institutional households composed of persons who reside in specifically designated institutions (e.g. hospitals, prisons, etc.). They may also include unrelated persons who reside in group quarters (120-1*) other than institutions. However, recent internationally recommended definitions restrict the terms household and household population to private households, and refer otherwise to persons not living in households."
Multilingual Demographic Dictionary,Chapter 1 • General concepts,111,"When a private household (110-4) contains several persons they are called members of the household1 and one of them will be the head of the household2. There is no universally accepted rule as to who is considered the head of the household; in some cases it may be the principal earner3. On most census schedules there appears a question dealing with the relationship4 (114-3*) of members of the household to its head. This enables a distinction to be made between different groups in composite households5 or complex households5 which contain members of more than one biological family or nuclear family (113-1). A composite or complex household can be disaggregated into several nuclei6, including a primary nucleus7 and secondary nuclei8. The nuclei are more commonly called families (112-1). The primary family9★ is that of the household head when it is defined, the others are called secondary families10★. Household size11 denotes the number of persons included in the household.
Note:The term householder is sometimes used to refer to the head of the household. The term headship is frequently encountered. The nucleus is also called a conjugal family unit."
Multilingual Demographic Dictionary,Chapter 1 • General concepts,112,"The family1 (cf. § 113 and § 115) is a different unit which must be carefully distinguished from the household (110-3). It is defined primarily by reference to relationships which pertain to or arise from marriage, reproduction or adoption, all of which are regulated by law or custom. The fundamental relationships are those established between a couple by marriage — and that existing between a couple as parents2, i.e., father3 and mother4, and their children5, i.e., sons6 and daughters7 .
Note:Parent, n. - parental, adj. - parenthood, n.: the state of being or becoming a parent. Father, n. - paternal, adj. Mother, n. - maternal, adj. Son, n. - filial, adj. Daughter, n. - filial, adj."
Multilingual Demographic Dictionary,Chapter 1 • General concepts,113,"Parents and their children are sometimes referred to as the biological family1, or nuclear family1 . Brothers2 and sisters3, without distinction of sex are called sibs4 or siblings4 . Siblings with only one parent in common are called half-brothers5 or half-sisters6. Extended families7 are larger family units generally composed of combinations of nuclear families. The vertically extended family8★ consists of three or more generations living in the same household or very close to each other. The horizontally extended family9★ involves siblings with their spouses and their children living together. The vertically extended family can generate special types such as the stem family10★ in which only one of the children (the heir) continues to reside with the parents after marriage, together with the heir’s spouse and their own children.
Note:The term simple family and elementary family are frequent synonyms for the terms biological or nuclear family. In a restricted sense, such as in fertility analyses, the term biological family may refer to parents and their own children, excluding adopted children. The terms composite family and joint family are frequent synonyms for the term extended family. In the most general sense of the term, an extended family may refer to all members of a kinship group."
Multilingual Demographic Dictionary,Chapter 1 • General concepts,114,"Persons related through common descent1 from the same progenitor2 or ancestor2 are called blood relatives3 or genetic relatives3 . The terms kin3 and in an aggregate sense kinship group3 are also used. The degree of relationship4 is generally computed by reference to the number of steps which are necessary before a common ancestor is reached, but there are many different methods of computation. The fundamental relation in each of these steps is the filial relation5 (cf. 112-6* and 112-7*) of child to parent, which is the reciprocal of parenthood6 (112-2*) i.e. the relation of a couple or of a father or a mother to offspring7 or progeny7 . Blood relationship must be distinguished from relationship by marriage8, which marriage establishes between one spouse and the kin of the other.: wife’s family of origin are in-laws to husband and vice versa.
Note:Descent, n. - descendant, n.: one linked through descent Ancestor, n. - ancestral, adj. Relative, n. - related, adj. - relationship, n.: the state of being related. The term relative is used for persons related by blood or marriage.Kin, n. and adj. - kinship, n.: the state of being kin. Relatives is sometimes also used for the collection of all kin. Progeny, n.: this term may also be used for all of the descendants of a common ancestor. In certain countries persons related by marriage may be referred to as in-laws"
Multilingual Demographic Dictionary,Chapter 1 • General concepts,115,"The family1 (cf. 112-1) as a unit in demographic studies representing all or part of a household (110-3) needs to be specifically defined, and definitions for different purposes may vary. A statistical family1 or census family1 generally consists of all members of a household who are related through blood, adoption or marriage. A household may, or may not include a family. A statistical family cannot comprise more than one household, although a household may include more than one family. In some countries the definition of a statistical family may approximate to the biological family (113-1); in others the definition may be based on the family nucleus2 consisting of either a married couple without children, a married couple with one or more never-married children or one parent with one or more never-married children. These may either form the census family itself or be the core of such a family. Married couples living with their biological children are called intact or sometimes traditional families3★.  By contrast, a broken family4★ is one in which one of the parents has been lost by death, divorce, separation or desertion. Families where one parent, separated or widowed, lives with her children may be also be named single parent families4★. Married couples, widowed or separated people who, at the time of the declaration, have no more children living in the household, may have special name, like in Germany, residual family (“Restfamilie”)5★. When these types of families are living within a household, they are called family household6★.
Note:In the United States of America, a sub-family is a married couple with or without children, or a parent with one or more never-married children, under 18 years of age, living as members of a household and related to but not including the head of the household and his wife. In Great Britain, the primary family unit consists of parents and their children, the parents’ sibs and ancestors."
Multilingual Demographic Dictionary,Chapter 1 • General concepts,116,"In demographic literature, the term generation1 has been given a precise meaning and refers to a group of persons born within a specified period of time, generally taken as a calendar year. The term cohort2 denotes a group of persons who experience a certain event in a specified period of time: thus birth cohort is a synonym for generation in the sense of 116-1, a marriage cohort is a group of persons married within a defined period, etc. In demography as in genealogy the term generation3 may also be used to denote the descendants of a group of persons who are themselves a generation in the sense of 116-1. Thus the children of a group of migrants are often referred to as the second generation9★. Occasionally we also use the expression third or fourth generation. Generations can be qualified according to their current age as, for example, the young and rising generation6★, the middle-aged generation7★ or the generation in the prime of life7★  and the older generation8★ while the age limits are often vague and therefore require clarification. Cohorts of people born during historical periods related to low birth rates (or high) can be referred as birth-dearth or low-birth-rate cohorts11★ (or high-birth-rate cohorts10★—more colloquially baby-boomers). Occasionally consideration is restricted to lines of descent through one sex only, thus a male generation4 or paternal generation4 are the sons of a generation of males, a female generation5 or maternal generation5 the daughters of a generation of females. These distinctions are normally used when the length of a generation or mean interval between successive generations is calculated. (cf. 713-1).
Note:Cohort, n.: the term cohort analysis is used to denote a method of analyzing data, in which the experience of individual cohorts is studied throughout their lives, or other specified periods.For purposes of military service the number of men who become liable to conscription in a given year is sometimes called the class of that year. In the United States the same term is used for a group of students who complete their studies at a particular school or university in a particular year. Because of the depletion of births during the First World war, particularly in France, the French term “classes creuses” is sometimes used in the literature."
Multilingual Demographic Dictionary,Chapter 1 • General concepts,120,"A dwelling1, a dwelling unit1, or living quarters1 are statistical abstractions denoting housing accommodations appropriate for occupation by one household (110-3). The size of a dwelling is measured by the number of its rooms2 or by its surface area3. The degree of crowding4 is a function of the size of the dwelling and the number of its inhabitants. Crowding standards are applied to distinguish overcrowded dwellings5 and insufficiently occupied dwellings6 . An unoccupied dwelling7 is a dwelling which is not used for residence either permanently or occasionally.
Note:A dwelling may consist of a private house, or part thereof, or a flat or an apartment which forms part of a block of flats or tenement house. In the United States of America a distinction is made between a one-household structure and a multiple-household structure, and all persons who are not members of households are regarded as living in group quarters. Statistics of houses by the number of floors or stories are sometimes provided. It should be noted that in Europe, the ground floor is not generally counted, whereas in the United States of America it is called the first floor. There is no general rule as to whether or not the kitchen is included in the number of rooms. Overcrowded, adj. - overcrowding, n."
Multilingual Demographic Dictionary,Chapter 1 • General concepts,121,"The occupier of a dwelling may be its owner1 or a tenant2 who rents it from an owner, who is then called landlord1. A tenant who rents a dwelling to a sub-tenant is called the principal tenant5★. A sub-tenant3 is a person who rents from a tenant. A person occupying a dwelling to which he or she has no legal title is called a squatter4 .
Note:A dwelling or apartment may be rented with or without furniture in which case it is respectively called a furnished dwelling or an unfurnished dwelling."
Multilingual Demographic Dictionary,Chapter 1 • General concepts,130,"The terms population statistics1 or demographic statistics1 refer to numerical data2 about populations, which are based on observations3 . After such observations have been collected4 on appropriate forms (206-1), the documents are edited5 and verified5 to eliminate obvious inconsistencies. The data are tabulated6 into certain groups7 or classes8 with common characteristics. Data processing9 includes all the steps between collecting and statistical analysis10★ (132-1).
Note:Statistics, n. - statistical, adj. - statistician, n.: specialist in statistics. Collect, v. - collection, n. Edit, v. - editing, n. Verify, v. - verification, n. Tabulate, v. - tabulation, n. Process, v. - processing, n."
Multilingual Demographic Dictionary,Chapter 1 • General concepts,131,"Data are usually referred to as raw data1 or crude data1 prior to their processing and tabulation and basic data1 or primary data1 after processing and tabulation. Basic data usually consist of series2 of absolute numbers3 which are put together in the form of statistical tables4 . In such tables the data are generally classified with respect to certain variables5 or variates5 such as age, number of children, etc., or with respect to certain attributes6 or characteristics6 (i.e. sex, marital status, etc.). Where data are classified with respect to several variables or attributes simultaneously the tables are called cross-tabulations7 or contingency tables7 . Summary tables8 give information in less detail than do individual tables9 .
Note:When the data relate to individuals (110-2) as their unit of analysis they may be referred to as micro-data. Aggregate data or macro-data relate to a unit of analysis other than an individual, for example, a nation or an administrative unit within a nation. Micro-data can be derived from several sources such as a field survey (203-5) or a sample of vital registration records. A new source of micro-data is the census public use sample, which is a systematic or a random sample of census returns that is made available for analytical purposes to interested individuals. A table which presents the distribution of a single variable or attribute within a population is generally called a frequency table."
Multilingual Demographic Dictionary,Chapter 1 • General concepts,132,"Using the basic data generally involves two phases. Analysis1 aims at isolating the components of the observed numbers (size, structure, extraneous factors and the phenomenon under investigation); synthesis2 is the process of recombining the disaggregated components in various ways. Either phase involves the calculation3 or computation3 of indices4 which may be denoted by various names (cf. § 133). In contrast to the basic data, these indices are referred to as results6 or synthetic indices5★. In a more restricted sense an index7 (pl. indexes or indices) or index number7 is a ratio showing the value of a given quantity relative to a base8, which is usually taken as 100. Some indices are good indicators9 of a complex situation; thus the infant mortality rate is sometimes used as an indicator of the health status of a population.
Note:Analysis, n. - analytical, adj. - analyze, v. Calculate, b. - calculation, n. - calculator, n.: a machine with minimal to modest data storage capabilities designed to facilitate a modest amount of arithmetic and statistical calculating.Compute, v. - computation, n. - computer, n.: a machine system designed to effect the transmission, storage and calculations of large data sets; it permits arithmetic and statistical calculations as well as logical processing of data. In a dated sense, the terms calculator and computer were used to designate the person(s) engaged in the computations."
