First Level Heading,Second Level Heading,Third Level Heading,Definition
Multilingual Demographic Dictionary,Chapter 6 • Fertility,626,"A family planning program1 seeks to introduce and diffuse birth control in a group of potential users2 or in a target population2. Teams of fieldworkers3, including canvassers3, motivators3 and distributors3, attempt to reach and convince the population to use contraception or abortion. The success of the program can be measured by the proportion of new acceptors4 in the target population, or by the acceptance rate4; for the acceptors of contraception, the continuation rate5 after a certain lapse of time and its complement, the termination rate6 or drop-out rate6 are also computed. Estimates of the numbers and proportions of births averted7 reflect the demographic effectiveness (625-4*) of the program. Contraceptive prevalence in a population is estimated by the proportion of current users8 of contraception from a relevant universe, such as married women of reproductive age.
Note:Special surveys of knowledge, attitudes and practice of contraception have been called KAP surveys in abbreviation."
Multilingual Demographic Dictionary,Chapter 6 • Fertility,627,"Contraception1 refers to measures which are taken in order to prevent sexual intercourse2 or coitus2 from resulting in conception; the term covers contraceptive sterilization (631-1). Birth control methods3 is used in a broader sense than contraceptive methods3 to include induced abortion (604-2). Abstinence4 from coitus, particularly periodic abstinence (628-4) is often included among contraceptive or birth control methods.
Note:Contraception, n. - contraceptor, n.: one who practices contraception. Contraceptive, adj. : used for contraception. Abstinence, n. - abstain, v."
Multilingual Demographic Dictionary,Chapter 6 • Fertility,628,"A distinction is frequently drawn between appliance methods1 of contraception and non-appliance methods2. One principal non-appliance method of contraception is coitus interruptus3 or withdrawal3. Another non-appliance method of contraception is periodic abstinence4 or the rhythm method4, in which coitus is avoided during the period when the woman is believed to be fecund and takes place only during the so-called safe period5 of the menstrual cycle. The basal body temperature method6 refers to the method in which the woman keeps track of her temperature to identify the safe period.
Note:Appliance methods include not only barrier methods which are used to prevent the union of the sperm and ovum, but also methods using other contraceptive devices such as the intra-uterine device (629-10) and other types of contraceptives such as the pill (630-4). The term natural family planning methods has been applied collectively to cover the rhythm method, the basal body temperature method, and other techniques like cervical mucous method which attempt to identify stages of the woman’s ovulatory cycle."
Multilingual Demographic Dictionary,Chapter 6 • Fertility,629,"The barrier methods which are more commonly used alone or in combination include the condom1 or sheath1, used by men, and the cervical cap2 or pessary2, the diaphragm3, tampon4 or sponge4, contraceptive jelly5, suppository6, foam tablets7 and douche8 with or without spermicide9, used by women. There are various types of intra-uterine devices10 (abbreviated to IUD10), including the loop10, the coil10, the copper T10, etc."
Multilingual Demographic Dictionary,Chapter 6 • Fertility,630,"Oral contraceptives1 are a method of hormonal contraception2 or contraception by steroids3. These inhibit ovulation by regular ingestion of the pill4, or by injections or implants."
Multilingual Demographic Dictionary,Chapter 6 • Fertility,631,"Sterilization1 results from various surgical procedures: on the male, vasectomy2 or occlusion3★ involves tying and cutting the vas deferens; on the female tubal ligation4 and salpingectomy5 or tubectomy5 involve interventions on the fallopian tubes. Hysterectomy6 or excision of the uterus, also involves sterilization of the woman.
Note:and 5. Various procedures are used to gain access to the Fallopian tubes, such as laparotomy, colpotomy or laparoscopy."
Multilingual Demographic Dictionary,Chapter 6 • Fertility,632,"The general term birth rate1 refers to a rate calculated by relating the number of live births observed in a population or sub-population during a given period to the size of the population or sub-population during the period. The rate is usually stated per 1,000, and the most usual period is one year. Where the term birth rate is used without qualification, it is understood to be the crude birth rate2, and all live births are related to the entire population. The total birth rate3 based on live births and late foetal deaths is sometimes calculated. Marital birth rates4 (legitimate birth rates4) and non-marital birth rates5 (illegitimate birth rates5) are also calculated with legitimate and illegitimate births in the numerator and the currently married and unmarried female population, respectively, in the denominator. The illegitimacy ratio6, the number of illegitimate births per 1,000 total births, is more frequently used, however. To compare the fertility of different populations, standardized birth rates7 are often used to eliminate the effect on the birth rate of certain differences in structure of the population (most commonly the age and sex structure). The child-woman ratio8, most commonly the number of children aged 0 to 4 per 1,000 women of childbearing age, e.g., 15 to 49, is used as an index of fertility when reliable birth statistics are not available.
Note:The denominator of the marital and non-marital birth rate is sometimes the total population. See note 4."
Multilingual Demographic Dictionary,Chapter 6 • Fertility,633,"The term fertility rate1 is often used when the denominator of the birth rate is restricted to a group of individuals of the same sex in the reproductive ages (620-1). This denominator is commonly the mid-year population in the stated period, but it may also be the number of years lived by the group during the period, or the mean size of the group. Unless otherwise indicated, these rates are female fertility rates2, and the rates are calculated for groups of women; the number of years lived by a given number of women in an interval is called the number of woman years3. Male fertility rates4 are computed sometimes in an analogous manner. Fertility rates are generally expressed as births per thousand (implied: individuals of the same category — sex, age, marital status, etc. — cf. 133-4*). Marital fertility rates5 or legitimate fertility rates5 relate the total number of legitimate births (610-3) to the number of currently married women; non-marital fertility rates6 or illegitimate fertility rates6 relate the total number of illegitimate births (610-4) to the number of single, widowed and divorced women. Overall fertility rates7 make no distinction according (610-1) to the marital status of the parents. The general fertility rate8 relates the total number of births to all women of reproductive age regardless of marital status. Rates based on a narrower age range (usually one-year or five-year age groups) are called age-specific fertility rates9 or age-specific birth rates9.
Note:In many expressions used in this and following paragraphs, birth rate is used synonymously with fertility rate. Marital fertility or legitimate fertility: the fertility of married persons (see 635-1). Non-marital fertility or illegitimate fertility: the fertility of unmarried persons."
Multilingual Demographic Dictionary,Chapter 6 • Fertility,634,"Order-specific fertility rates1 relate births of a certain order to a number of women, to a number of marriages or to a number of births of the preceding order. Parity-specific fertility rates2 or parity-specific birth rates2 not only restrict the numerator to births of a given order, but also restrict the denominator to the women of the parity (611-6) at risk (134-2), e.g., second order births to one-parity women. Such rates are usually age-specific or duration-specific. In parity-specific birth probabilities3, the numerator consists of the number of births of order x + 1 occurring during a period, and the denominator consists of the number of women of parity x at the beginning of the same period."
Multilingual Demographic Dictionary,Chapter 6 • Fertility,635,"When studying marital fertility1 it is possible to arrange the data by marriage cohorts (116-2) of the mothers, and marriage duration-specific fertility rates2 are often computed in preference to age-specific marital fertility rates3."
Multilingual Demographic Dictionary,Chapter 6 • Fertility,636,"The term cohort fertility1 refers to the reproductive performance of particular birth or marriage cohorts (116-2). When the age-specific or marriage duration-specific fertility rates are summed from the cohort’s beginning of exposure to risk until some later date, we speak of cumulative fertility2:  cumulative age-specific fertility3★ or cumulative duration-specific marital fertility3★ when then ending date is that of a womans birthday or marriage (501-4), completed fertility4 or lifetime fertility4 is the cumulative fertility until the date when all members of the cohort have reached the end of the reproductive period. The sum of the products of the fertility rates of the cohort by the probability of survival of the women to successive ages could be called the cumulative net fertility5, net cumulative age-specific fertility6★ or net cumulative duration-specific marital fertility6★ and net complete fertility7★ or net lifetime fertility7★ of the cohort.
Note:Before the end of the reproductive period, the terms incomplete fertility or fertility to date are employed to show that the cohort’s cumulative fertility may be expected to increase."
Multilingual Demographic Dictionary,Chapter 6 • Fertility,637,"Censuses and surveys may provide information on fertility when they include questions on the number of children born to enumerated women or couples, either during the current marriage1, or overall. The mean number of children ever born per woman2 or average parity2 can be computed. The number of children per couple is sometimes called average family size3. It is also possible to calculate the mean number of births per marriage4. Special attention is paid to completed fertility of marriages5, those in which the wife had reached the end of the reproductive years before the marriage was dissolved. The final parity6 or completed parity6, i.e., the mean number of children per woman past the childbearing age, is not very different from completed fertility (636-4). The tabulation of final parity or completed fertility by number of children serves to compute series of parity progression ratios7; these are fractions whose denominator is the number of women with n children, and whose numerator is the number of women with n + 1 children. Special studies yield information on family formation8 and the family life cycle8. Among those, frequency of premarital conceptions9★, birth intervals (612-1) and the age at the birth of the last child10 for women of completed fertility are of particular interest."
Multilingual Demographic Dictionary,Chapter 6 • Fertility,638,"Fertility histories1 or reproductive histories1 are accounts obtained for individual women of the important events in their reproductive lives, such as marriages, pregnancies, births, infant deaths, etc., and their dates. Fertility histories are often obtained retrospectively from surveys. Family forms1 are used in historical demography (102-1), where they are established for a married couple and its children by family reconstitution2 on the basis of vital records (211-3). A woman’s pregnancy history3 or pregnancy record3 contains detailed information about her pregnancies including the date when each began and ended, and the outcome of the pregnancy. Such detailed records on the timing of fertility have been used for various purposes. For example, they can provide information on natural fertility4, i.e., fertility in the absence of family limitation (624-4). They are also used to estimate fecundability5, the probability of conceiving per menstrual cycle (622-2). A distinction is made between natural fecundability6, in the absence of contraception, and residual fecundability7 in the opposite instance. The term effective fecundability8 designates a fecundability that is reckoned in terms of conceptions that result in live births only. The conception rate9 during the period of exposure to risk often estimated using the Pearl index10★ (613-1) is used to measure the effectiveness of contraception during periods of contraceptive use.
Note:Birth histories are usually limited to live births. When used alone, the word fecundability stands for natural fecundability."
Multilingual Demographic Dictionary,Chapter 6 • Fertility,639,"A summary index of period fertility1, i.e., the fertility of a particular year or period, computed by the summation of the series of age-specific fertility rates constituting the fertility schedule2 and representing a synthetic measure of fertility3, is the total fertility rate4 or total fertility4. Other summary period indices can be obtained, such as the total marital fertility rate5, the summation of marriage duration-specific fertility rates, and the order-specific total fertility rate6, the summation of age-specific fertility rates order by order. The ratio of births to marriages7 is computed by relating the number of births of a given year, either to the marriages of the year, or to a weighted average of the marriages of the current and of the preceding years.
Note:Also, fertility distribution or fertility function. This is not a rate in the meaning of (133-4). Total fertility for a given year represents the number of children that would be bom per 1,000 women if they experienced no mortality and were subject to the age-specific fertility rates observed for that year. The period gross reproduction rate (see 711-4) which is derived by multiplying the total fertility rate by the proportion of female births, has often been used in the past, but the total fertility rate is preferred at present as the summary index of period fertility. Or total marital fertility. The term is also used to describe the sum of the age-specific marital fertility rates above age 20."
Multilingual Demographic Dictionary,Chapter 6 • Fertility,640,"Where induced abortion (604-2) has been legalized, it is possible to compile statistics on legal abortions (604-4). The abortion rate1 is a measure of the frequency of abortion in a population during a given period, usually a year. Abortions may be related to the total population or to the number of women in the reproductive ages and may be specific for age, parity or any other characteristic. The abortion ratio2 is a measure of the frequency of abortions in relation to the number of live births (601-4) during the same period. The life-time abortion rate3 is the sum of age-specific abortion rates4★ and is a synthetic measure of abortion per woman or per 1000 women. These rates are the ratio of the number of abortions reported at each age to years lived by all women of the same age. If women can be classified according to their marital status, abortion rates by age and marital status5★ can be obtained. It is often also relevant to divide the number of abortions by the number of conceptions and so to calculate the probability that a pregnancy results in an abortion by age and marital status6★."
Multilingual Demographic Dictionary,Chapter 7 • Population growth and replacement,701,"The interaction of fertility, mortality and migration leads to a consideration of population growth1. A zero population growth10★ refers to a population of constant size. It is convenient to regard population decline2 as negative growth3. A distinction may be drawn between a closed population4 in which there is no migration either inwards or outwards and whose growth depends entirely on the difference between births and deaths, and an open population5 in which there may be migration. The growth of an open population consists of the balance of migration6 or net migration6 and natural increase7, which is the excess of births over deaths8 or deficit of births over deaths9★ sometimes called the balance of births and deaths8. Any change in one variable affects the overall growth and structure of a population; in this context growth effects11★ and structural effects12★ are determined."
Multilingual Demographic Dictionary,Chapter 7 • Population growth and replacement,702,"The ratio of total growth in a given period to the mean population of that period is called the growth rate1. Occasionally this rate is computed with the population at the beginning of the period rather than with the mean population as a denominator. When population increase over a period of more than one calendar year is studied, the mean annual rate of growth2 may be computed. In computing this rate it is sometimes assumed that the population is subjected to exponential growth3 during the period, and time is treated as a continuous variable. The size of an exponential population4 would grow as an exponential function of time. The exponential growth rate5 is equal to the instantaneous rate of growth5. The ratio of natural increase (701-7) to the average population during a period is called the crude rate of natural increase6 and is equal to the difference between the crude birth rate and the crude death rate. The vital index7 is the ratio of the number of births to the number of deaths during a period; this measure is no longer much used.
Note:When time is treated as a discrete variable, reference is made to geometric growth. This is occasionally called a Malthusian population, but the term is ambiguous in view of its sociological connotations (see 906-1)."
Multilingual Demographic Dictionary,Chapter 7 • Population growth and replacement,703,"It can be shown that when a closed population (701-4) is subjected to constant age-specific fertility and mortality rates (631-8; 412-1) for a sufficiently long period of time, its annual rate of increase will tend to become constant. This constant rate of increase is called the intrinsic rate of natural increase1, and a population which has reached this stage is called a stable population2. The proportion of persons in different age groups in such a population will be constant, i.e., the population will have a stable age distribution3. This stable age distribution is independent of the initial age distribution4 and depends only on the fertility and mortality rates that are kept constant. Human populations never reach exact stability in practice, as fertility and mortality rates constantly change, but the computation of a stable population as a model and of its intrinsic rates may provide an index of the growth potential5 of a set of age-specific fertility rates applied to a non stabilized age structure. Related to the growth potential, the moment of inertia of a population or demographic momentum11★ should be mentioned: it refers to the dynamics hidden in the age structure due to a delayed growth response caused by the biological fact that from the time of birth of a cohort (116-2) to the beginning of their period of fertility (620-1) a certain amount of time passes. A population may for this reason still grow, even though the birth rate drops long ago. The reverse case is also possible. The momentum is particularly altered in case of discontinuity in the evolution of births and abrupt reversals of trends. A stable population in which the intrinsic rate of natural increase is zero is called a stationary population6. In such a population the numbers in a given age group are equal to the integral of the survivorship function (431-3) of the life table taken between the upper and lower age limits of the group, multiplied by a factor of proportionality common to all age groups. A quasi-stable population7 is a formerly stable population with constant fertility and gradually changing mortality; characteristics of this type of population are similar to those of a semi-stable population8★ which is a closed population with a constant age structure. A logistic population9 is a population growing in accordance with the logistic law10 of growth, i.e., a population in which the growth rate decreases as a linear function of the population already alive and which will tend asymptotically to an upper limit.
Note:The intrinsic rate, also called by its inventor Lotka, the true rate of natural increase, is equal to the difference between the intrinsic birth rate (or stable birth rate) and the intrinsic death rate (or stable death rate). Stable, adj. - stability, n. - stabilize, v.Stable population analysis uses the properties of stable population models to estimate various characteristics of real populations. Stationary, adj. - stationarity, n."
Multilingual Demographic Dictionary,Chapter 7 • Population growth and replacement,710,"The theory of population replacement1 or population reproduction1 (see § 116) treats population as a renewable resource2 in the mathematical sense of the term. A distinction is drawn between gross reproduction3 or gross replacement3, where no account is taken of mortality before the end of the reproductive period (620-1), and net reproduction4 or net replacement4, in which this mortality is taken into account.
Note:Also reproductivity. For another sense of reproduction see 601-2."
Multilingual Demographic Dictionary,Chapter 7 • Population growth and replacement,711,"In this study of replacement a number of indices, replacement rates1 or reproduction rates1 are used. Reproduction rates are generally female reproduction rates2 or maternal reproduction rates2. The female net reproduction rate3 is defined as the average number of live daughters that would be born to a hypothetical female birth cohort (116-2) which would be subjected to a set of current age-specific fertility (631-8) and mortality rates (401-2). A female gross reproduction rate4 is computed similarly on the assumption that mortality before the end of the reproductive age is zero. Male reproduction rates5 or paternal reproduction rates5 can be computed analogously using male births and a male birth cohort, and certain types of joint reproduction rates6 which take both sexes into account have been proposed. Where the experience of an actual cohort is used in the construction of reproduction rates, cohort reproduction rates7 or generation reproduction rates7 are obtained. The mortality and the fertility rates used in the construction of these rates will refer to different periods of time. Where statistics of fertility by age are not available, the so-called replacement index8 may be used. This ratio relates the quotient of the population of children of a given age (as a rule those 0-4 years) to the number of women of childbearing age in the actual population, to the corresponding quotient in the stationary population (703-6)."
Multilingual Demographic Dictionary,Chapter 7 • Population growth and replacement,712,"Other replacement indices are also computed. For instance, the net reproduction rate is sometimes split into a legitimate component1 and an illegitimate component2. Again, a nuptial reproduction rate3 has been computed, showing the number of legitimate daughters that will be born to a newly-born female if current rates of mortality, fertility, nuptiality and dissolution of marriage remain unchanged. Generally such rates are for females, but it would be possible to compute analogous rates for males."
Multilingual Demographic Dictionary,Chapter 7 • Population growth and replacement,713,"The net reproduction rate (711-3) and the intrinsic rate of natural increase (703-1) are closely related to one another. The net reproduction rate measures the increase in the stable population (703-2) implied by the given age-specific fertility and mortality rates over a period equivalent to the mean length of a generation1 or the mean interval between successive generations1. This length of a female generation is equal to the mean age of mothers2 giving birth to live daughters, with current age-specific fertility and mortality rates. Period reproduction rates are current indices (cf. 152) which relate to hypothetical cohorts3 or synthetic cohorts3.
Note:The mean age of fertility, i.e., the mean age of the fertility schedule is only approximately equal to the mean length of a generation. The mean length of a male generation similarly is equal to the mean age of fathers at the birth of their children."
