First Level Heading,Second Level Heading,Third Level Heading,Definition
Multilingual Demographic Dictionary,Chapter 2 • The treatment and processing of population statistics,201,"Current population statistics1 may be distinguished from statistics of population change2. They deal with the static aspects of the subject and give an instantaneous picture of the population at a given moment of time: the statistical units (110-1) used are generally households (110-3), individuals (110-2), etc. Statistics of population change are concerned with the continuous processes of change which affect a population, and deal largely with vital events3,such as births, marriages, deaths, and with migration (801-1). Nonrenewable events4 (e.g. deaths) may be distinguished from renewable events5 such as pregnancies, births or migratory moves; renewable events are assigned an order6 based on the number of previous events of the same nature for the same person. Statistics of population change are a principal source for the study of population processes7, sometimes called population dynamics7. Censuses (cf. 202) are the main source of information on the state of the population8 . Vital Statistics (212-1) are the primary source of data for the study of population growth9 (cf. 701). Occasionally they deal with natural increase10 only, i.e. they do not take into account movement between the population studied and other populations, but logically migration statistics (812-1) are a part of the statistics of population change. The term population movement11★ is used to refer to the geographical movement of a population."
Multilingual Demographic Dictionary,Chapter 2 • The treatment and processing of population statistics,202,"Population censuses1 are taken to obtain information about the state of the population (201-8) at a given time. Most commonly all inhabitants of a particular country are counted simultaneously:. the census is then called a general census2 Occasionally, however, only a section of the population is counted, e.g. the inhabitants of a given area, in which case the census is called a partial census3. The term ""Census"", however, denotes that an attempt was made to enumerate every member of the population concerned and to achieve complete coverage4 of the population. A micro census5 is limited to a sample of the population, usually large in size, and belongs in the category of sample surveys6. Censuses or surveys are sometimes preceded by pretests7 or pilot surveys7. To verify the accuracy and completeness of enumeration (230-2), a post-enumeration check8★ is performed using a post-enumeration survey9.
Note:Census, n. - censal, adj. The intercensal period is the time elapsing between two successive censuses.Modern censuses correspond to what used to be called head counts. Population counts include any estimation procedure, however imprecise, based for example on the counting of baptisms (214-2) registered for a number of years, or of hearths (110-3) or even parishes (214-1)."
Multilingual Demographic Dictionary,Chapter 2 • The treatment and processing of population statistics,203,"An enumeration1 is any operation which is designed to yield a population total. It differs from a simple count2 in that a list3 is generally prepared. An inquiry4 or survey4 on the other hand, is generally an operation which is designed to furnish information on a special subject (e.g. the labor force) and which has limited aims. A field inquiry5 or field survey5 is an inquiry in which information is obtained by personal interview6. In postal inquiries7 or mailback surveys7 questionnaires (206-3) are sent out by post with a request to return them completed. A retrospective survey8 focuses on past demographic events; in a multiround survey9 those events that occurred since the previous survey are noted from the second round on. This type of survey should not be confused with a call back10, a term used to describe the instance where the interviewer is obliged to make several attempts to reach a respondent. In censuses, information may be obtained by either direct interview11, or by self-enumeration12. In the first method, also called canvasser method11 the enumerator (204-2) notes the information provided by or about the respondents; in the second method, also called householder method12, the questionnaire is completed by the respondents (204-1) themselves. Self-enumeration may take the form of a mail census13.
Note:Enumeration, n. - enumerate, v. Count, n. - count, v. List, n. - list, v. Survey, n. - survey, v."
Multilingual Demographic Dictionary,Chapter 2 • The treatment and processing of population statistics,204,"Persons who answer questions in a census (202-1) or a survey (203-4) are called respondents1 or informants1. Persons who collect (130-4) the information are called interviewers2, field workers2 or enumerators2, the last term being usually reserved for persons collecting information in a census. Enumerators usually work under the control of supervisors3 or inspectors3. General censuses (202-2) are usually taken by the statistical departments4 of individual countries.
Note:The term interviewee is sometimes used. In the United States of America the office responsible for the census is called the Bureau of the Census; in England and Wales it is the General Register Office, in Scotland the General Registry Office; both are headed by a Registrar General."
Multilingual Demographic Dictionary,Chapter 2 • The treatment and processing of population statistics,205,"Censuses are usually compulsory1, i.e. respondents (204-1) are under a legal obligation to provide the required information; in this respect they are different from voluntary inquiries2 (cf. 203-4), where the problem of non-response3 may become important. This is particularly the case in postal inquiries (203-7), where it is often necessary to follow-up4 the first questionnaire by a second, or sometimes by a visit. Non-respondents5 are frequently divided into those who refuse6, i.e. who are unwilling to cooperate in the inquiry, and those who could not be found by the interviewer (204-2). The latter are counted as absentees7 or no contacts7. The replacement of an unusable sample unit with another unit is referred to as substitution8. The proportion of refusals9 in response to a given question is a useful index of the reactions of the respondents.
Note:Refuse, v. - refusal, n. Absentee, n. - absent, v. - absence, n."
Multilingual Demographic Dictionary,Chapter 2 • The treatment and processing of population statistics,206,"The forms1 used for the collection of information have a number of different names. The term schedule2 is frequently used, especially the term census schedule2. Most of the forms are questionnaires3, particularly when they are designed for completion4 by the respondents themselves. At other times, officials obtain statements5, or particulars6 which they extract7 from documents primarily used for non-statistical purposes. The questions are usually of two basic types: closed ended questions8 in which a respondent replies by selecting one out of a limited number of responses listed on the questionnaire or open ended questions9 to which the respondent may give a spontaneous answer."
Multilingual Demographic Dictionary,Chapter 2 • The treatment and processing of population statistics,207,"A census schedule (206-2) may be an individual schedule1 containing information relating only to a single individual, a household schedule2 containing information relating to each of the members of the household (110-3), or a collective schedule3, nominal list3 or enumerator’s schedule3 on which the enumerator (204-2) enters successively data for all the persons he enumerates. There may be special schedules for the institutional population (310-7), which are called institutional schedules4."
Multilingual Demographic Dictionary,Chapter 2 • The treatment and processing of population statistics,210,"Census operations1 usually begin with the delimitation of census areas2 and enumeration districts3. Enumeration districts in towns and cities may consist of one or several blocks4, a block being defined as a group of buildings around which it is possible to walk without crossing a street, or which are bounded by some obstacle, such as a railway line or a river. Most of the larger cities of several countries have been subdivided into statistical areas called census tracts5 which may contain one or several enumeration districts."
Multilingual Demographic Dictionary,Chapter 2 • The treatment and processing of population statistics,211,"Vital events1 may be defined as births, deaths, stillbirths, foetal deaths, marriages, adoptions, legitimations, recognitions, annulments, divorces and separations; in short all the events which have to do with an individual’s entrance into or departure from life together with changes in civil status2. Records of these events are generally called vital records3, or registration records3. For legal reasons vital events have, in many countries, long been the object of vital registration4 or civil registration4. Birth registration5, marriage registration7 and death registration9 use special forms as birth records6, marriage records8 and death records10; these are the most common types of registration documents. The person responsible for maintaining these registers is called the registrar11.
Note:Register, n. - register, v. - registration, n.Civil registration systems are the descendents of registers (214-1) kept by religious groups. A register was originally a bound book in which one or several lines were devoted to an event Today individual records often take the form of certificates. They are separate documents for each recorded vital event."
Multilingual Demographic Dictionary,Chapter 2 • The treatment and processing of population statistics,212,"Vital statistics1 or registration statistics1 are obtained by processing the registration record or a statistical report2 established at the time of registration. Tabulations by place of residence3 of the mother or of the decedent are often regarded as more useful for demographic purposes than tabulations by place of occurrence.
Note:In many countries, the time of registration of a birth may be markedly later than the time of occurrence."
Multilingual Demographic Dictionary,Chapter 2 • The treatment and processing of population statistics,213,"The registers mentioned in a preceding paragraph (cf. 211-4) are distinct from the population registers1 of those countries which possess a system of continuous registration2. In these registers every member of the population or every family may be represented by a card3, and the register is maintained4 or updated4 through information which reaches it through the local registration offices and through registration of any changes of residence5 (cf. 310-6). It is usually matched6 with the census results and brought up to date at regular intervals by special checks7.
Note:A card file is a collection of cards. In general, a file is a collection of records arranged in convenient order."
Multilingual Demographic Dictionary,Chapter 2 • The treatment and processing of population statistics,214,"Historical demography (102-1) often uses documents which precede or anticipate the development of civil registration (211-4) and nominal lists (207-3) from censuses. Parish registers1 or parochial registers1 contain information on the religious close equivalents of vital events such as baptisms2, religious marriages (503-2), and burials3. For chrisoms5, summary baptised infants4★ who die at home prior to a formal church ceremony, only the burial record is available. Nominal lists contain information either on a portion of the population or more rarely on the whole population. They include the a status animarum6 which are nominal lists of all parishioners, lists of communicants7 and confirmation lists8, as well as administrative and fiscal documents such as hearth tax lists9, taxation rolls10 and military conscription lists11."
Multilingual Demographic Dictionary,Chapter 2 • The treatment and processing of population statistics,215,"Data are extracted from parish registers with the help of several types of event forms1 or slips1 . These include the baptism form2, marriage form3 and burial form4. The names of the persons of record5 (i.e. the persons being baptized, buried or getting married) are inscribed on these forms, and information is recorded about the parents and other persons such as the godfather6, the godmother7 and the witnesses8. Other anonymous rolls9★, nominal rolls10★ and transcription sheets11 are also used for summary extraction of the data, either with or without the names of the subjects. Family reconstitution (638-2) makes use of family forms (638-1). Extant family histories or genealogies12 that reconstitute the descendants of an individual or a family are, under certain conditions, a valuable source of information on the demographic characteristics of the selected families."
Multilingual Demographic Dictionary,Chapter 2 • The treatment and processing of population statistics,220,"The process of obtaining statistical data from documents not primarily designed for this purpose is called extraction1. In general, whatever its source, statistical information is subjected to processing2 which may be manual3, mechanical4, electronic5 or a combination of these modes. Manual processing involves no equipment more complex than the desk calculator6. Electronic processing uses computers (132-2*). Regardless of the mode of processing, certain types of operations7 must be performed including editing8 of the data, tabulation (130-6*) and calculation (132-2) and table preparation9. These operations are made more or less complex depending on the mode of processing which is selected.
Note:Extraction, n. - extract, v. Processing, n. - process, v. The terms to process information, data processing, are used widely. Editing, n. - edit, v. In English, the term refers to an operation performed either on the basic document or on the machine - readable data, to correct inconsistencies or eliminate omissions. In French, edition refers to the stage of table preparation."
Multilingual Demographic Dictionary,Chapter 2 • The treatment and processing of population statistics,221,"Editing the data usually requires the prior coding1 of a certain number of entries on the basic document2. The coding scheme3 establishes a correspondence between an entry and its translation into numeric or alphabetic codes. The code book collects and describes the coding schemes used with a particular set of basic documents. A coding scheme is usually designed to facilitate later groupings of the data. In contrast, a classification4 is a mere list of individual codes where each heading5 is given one or several numbers. After the data have been coded, they constitute a file (213-3*) which can be converted to machine readable form. The second stage in the editing consists in the cleaning6 of the file, through elimination of errors by validity checks7 and consistency checks7; these can be internal checks within each statistical unit (cf. 110-1) or may result from the comparison of different units. After errors have been identified, they may be corrected in the original document or the file by some automatic procedure.
Note:Code, n. - code, v. - coding, n."
Multilingual Demographic Dictionary,Chapter 2 • The treatment and processing of population statistics,222,"The edited data are rarely used directly; they are subjected to grouping (130-7) and tabulation (130-6*), and this normally leads to a presentation in the form of statistical tables (131-4). These may be the outcome of sorting1, either manual or mechanical, resulting in the reorganization of the elements in a set according to predetermined rules, or more simply of a systematic count of the elements presenting a selected characteristic. The choice of elements or of characteristics may be based on the values of one or several quantitative attributes, or on the modalities2 of one or several qualitative attributes. Few studies can do without computation, simple or complex, isolated or repetitive, and the computer (225-2) now allows calculation that would have been too lengthy by hand. These capabilities have led to the development of techniques of data analysis3. Deterministic and stochastic models (cf. 730) often require considerable computations, and so do simulations (730-6).
Note:Sorting, n. - sort, v."
Multilingual Demographic Dictionary,Chapter 2 • The treatment and processing of population statistics,223,"The stage of table preparation (220-9) aims at making the results of processing conveniently available in the form of listings1, numerical tables (131-4) or charts (155-2), all of which are commonly used in descriptive statistics2. The use of computer graphing3 and computer cartography3 permits the mass production of graphical presentation."
Multilingual Demographic Dictionary,Chapter 2 • The treatment and processing of population statistics,224,Purely mechanical processing (220-4) did not involve the use of electronic equipment1 which has come to replace the earlier tabulating machines2 or unit record machines2 and is much more versatile.
Multilingual Demographic Dictionary,Chapter 2 • The treatment and processing of population statistics,225,"Demographic research depends heavily on electronic data processing1 using the computer2. The term hardware3 refers to the physical component, whereas software4 supplies the user5 with ways to have access to the computer. Computer specialists6 include programmers7 who write programs8 conceived by system analysts9."
Multilingual Demographic Dictionary,Chapter 2 • The treatment and processing of population statistics,226,"The hardware (225-3) components of a computer (225-2) include one or several central processing units1, a central memory2, one or more mass storage devices3 which use magnetic tapes4 or disks5 and a set of input-output devices6. The software (225-4) components include the operating system7, which has the task of efficiently managing the available facilities8 for the users (225-5) running the users’ programs9 and the processing programs10 which are preestablished programs (225-8) designed for the solution of standard problems."
Multilingual Demographic Dictionary,Chapter 2 • The treatment and processing of population statistics,227,"A user (225-5) can process his problem by writing a program (225-8) in a general programming language1 such as Fortran, Cobol, Basic or Algol, or a specific language, designed to use the processing programs (226-9) stored in the central memory (226-2) of the computer such as a data base management system2 used to create and maintain a data bank2, a survey processing program3 or a statistical package4. The devices which are used to enter and receive information from the computer can differ according to the mode of processing. In batch processing7, the normal input and output units are the card reader5 and the line printer6. A console8 is the normal input and output unit for processing in a timesharing mode9. In either instance the entry units may be spatially separated from the computer and processing under these conditions is accomplished by remote terminal10.
Note:In addition to programming languages as defined above, other types of languages can be used to manipulate the operating system; these are usually referred to as job control language."
Multilingual Demographic Dictionary,Chapter 2 • The treatment and processing of population statistics,228,"Any information processed in a computer (225-2) undergoes three main phases. First, data entry1 or input1 which may be done by using an on line2 device such as a keyboard console (227-8). Data which is already stored in the computer may be accessed from either central memory (226-2) or from one of the mass storage devices (226-3) and used as input data. This is part of the data collection3★ which goes from extraction (220-1) to the transcription on an electronic medium, through validity checks (221-7) and consistency checks (221-8) that can be made ​​during data entry when working on line. The second phase, processing (220-2), is divided into two main types: numerical processing4 and non-numerical processing5. Statistical or arithmetic computations are normally the operations contained in the former while data manipulation operations are the focus in the latter. In a third phase, occasionally referred to as output phase, the processed results6 or output6 may be printed out on the line printer (227-6) or saved as a file on a mass storage device (226-3) for further processing. Results may also be diverted to a plotter7 to obtain processed results in the form of a graph or a figure."
Multilingual Demographic Dictionary,Chapter 2 • The treatment and processing of population statistics,230,"The accuracy1 of population statistics will depend among other factors on the completeness2 of the count of individuals, groups or events on which they are based. Omissions3 and undercount3 tend to generate underestimation4 while multiple counting5 leads to over-estimation6. Additional sources of error include misreporting7 of a characteristic such as age and classification errors8. Such inaccuracies are sometimes detected by post-enumeration tests9 or quality checks10. Occasionally certain questions are not answered or insufficiently answered and this may lead to considerable inaccuracy, the incidence of which is indicated by the frequency of the class designated as non-response11, not stated11, unknown11,  undeclared11, not specified11, poorly defined11 or misspecified11 etc...
Note:Accuracy, n. - accurate, adj. Completeness, n. - complete, adj. The terms ""complete"" and ""completeness"" are used here to express the absence of omissions. The same terms may also be used to refer to coverage, as in 202-4. The omission of some events from vital registration is called underregistration, and from a census or survey, underenumeration. The expression double counts is often used in this sense."
Multilingual Demographic Dictionary,Chapter 3 • Distribution and classification of the population,301,"Population statistics are generally presented in terms of the geographical distribution of the population1 or the spatial distribution of the population1, and also by structure (144-4). Each population lives in a given area2 or territory2 (305-6), and the study of the geographical distribution3 or spatial distribution3 deals with the way in which they are distributed over the territory.
Note:Territory, n. - territorial, adj."
Multilingual Demographic Dictionary,Chapter 3 • Distribution and classification of the population,302,"The territory (301-2) in which a population lives will generally be divided into sub-areas1. For administrative purposes it may be divided into administrative areas2, administrative units2 or administrative districts2 sometimes known as legal divisions2 or political divisions2. Geographers on the other hand, may divide the area into regions3 or zones4 which may or may not correspond to administrative units. The term ""region"" or ""zone"" may be used in a number of different senses and the areas referred to may be of very different sizes. Thus one speaks of the polar regions, of climatic zones or of metropolitan regions. The terms natural region5 and economic region6 are used by geographers. The term natural area7 is used in human ecology (104-5) to define an area occupied by a population with distinct characteristics."
Multilingual Demographic Dictionary,Chapter 3 • Distribution and classification of the population,303,"Administrative units differ from country to country and over time in the same country, so that the same word may cover different situations. Minor civil divisions include townships1 and parishes1; major civil divisions receive names such as states2 or provinces2, and intermediary units are often called counties5 and districts6. In Canada, for example the main administrative divisions, by increasing order of size, are the township8, the county9 and the province10. As another example, the main administrative division in France are now the regions2 which correspond to the province and the departements 3★ which correspond to the cantons4★ in Switzerland where districts7★ and circles11★ are minor civil divisions.  In the United States, parishes are equivalent to counties which are the unit above townships and cities but below states.
Note:Villages, boroughs and cities are other names sometimes given to the smaller administrative units. Municipality is a general descriptive term for minor civil division."
Multilingual Demographic Dictionary,Chapter 3 • Distribution and classification of the population,304,"A population may be settled1, sedentary1, or nomadic2, i.e., migrating back and forth within a given area and without fixed abode. Nomads who are in the process of becoming settled are called semi-nomadic3. Occasionally primitive peoples may have a territory allocated exclusively to themselves called a native reserve4 or reservation4.
Note:Nomadic, adj.- nomad, n."
